Title,Description,Link,Publication Date
Путин назначил двух новых замов директора ФСИН,Президент России Владимир Путин подписал указ о назначении двух новых заместителей директора Федеральной службы исполнения наказаний. Назначение получили генералы Андрей Кочуков и Андрей Шмидко.,https://rg.ru/2025/10/06/putin-naznachil-dvuh-novyh-zamov-direktora-fsin.html,"Mon, 06 Oct 2025 15:11:01 +0300"
"Инициатива по созданию ""стены дронов"" встретила резкую критику внутри Евросоюза","Президент Франции Эмманюэль Макрон и другие лидеры стран Евросоюза скептически восприняли предложение главы Еврокомиссии о создании на восточной границе блока ""стены против дронов"". Об этом пишет британская газета Financial Times.",https://rg.ru/2025/10/06/iniciativa-po-sozdaniiu-steny-dronov-vstretila-rezkuiu-kritiku-vnutri-evrosoiuza.html,"Mon, 06 Oct 2025 15:10:09 +0300"
Поклонник в костюме Человека-паука залез в окно квартиры певицы Доры,В окно квартиры кумира подростков Доры (настоящее имя певицы - Дарья Шиханова) залез поклонник в костюме Человека-паука.,https://rg.ru/2025/10/06/poklonnik-v-kostiume-cheloveka-pauka-zalez-v-okno-kvartiry-pevicy-dory.html,"Mon, 06 Oct 2025 15:10:02 +0300"
Из-за ракетного удара в Белгороде погиб мужчина,"В понедельник Белгород оказался под еще одним ракетным ударом украинской стороны, <a href=""https://t.me/vvgladkov/16496"" rel=""noopener noreferrer"" target=""_blank"">сообщил</a> губернатор Вячеслав Гладков.",https://rg.ru/2025/10/06/reg-cfo/iz-za-raketnogo-udara-v-belgorode-pogib-muzhchina.html,"Mon, 06 Oct 2025 15:09:59 +0300"
Смолов прокомментирует матчи теннисного турнира в Шанхае,"Известный футболист, чемпион России в составе ""Краснодара"" Федор Смолов попробует себя в новом качестве. Он будет комментировать матчи теннисного турнира категории ATP-1000 в китайском Шанхае.",https://rg.ru/2025/10/06/smolov-prokommentiruet-matchi-tennisnogo-turnira-v-shanhae.html,"Mon, 06 Oct 2025 15:08:00 +0300"
Умер актер и режиссер Майкл Драксман,На 85-м году жизни скончался Майкл Драксман. О кончине достаточно известного в своей нише кинематографиста сообщил портал IMDb.,https://rg.ru/2025/10/06/umer-akter-i-rezhisser-majkl-draksman.html,"Mon, 06 Oct 2025 15:06:01 +0300"
Появилось видео огромного столба черного дыма над Черниговом,Жители Чернигова публикуют кадры мощного пожара после удара ВС РФ.,https://rg.ru/2025/10/06/poiavilos-video-ogromnogo-stolba-chernogo-dyma-nad-chernigovom.html,"Mon, 06 Oct 2025 15:03:00 +0300"
В России начались продажи внедорожников Toyota 4Runner 2025 года: очень дорого,"В ходе мониторинга сайтов объявлений ""Российской газете"" удалось обнаружить у одного из столичных дилеров новый внедорожник Toyota 4Runner 2025 года выпуска. Продавец оценил машину в 9 900 000 рублей.",https://rg.ru/2025/10/06/v-rossii-nachalis-prodazhi-vnedorozhnikov-toyota-4runner-2025-goda-ochen-dorogo.html,"Mon, 06 Oct 2025 15:01:07 +0300"
Патрушев: Россия начинает заменять иностранные семена отечественными,"Вице-премьер Дмитрий Патрушев сообщил президенту Владимиру Путину, что Россия начинает заменять иностранные семена отечественными. По его словам, особенно это касается выращивания подсолнечника и сахарной свеклы.",https://rg.ru/2025/10/06/patrushev-rossiia-nachinaet-zameniat-inostrannyh-semian-v-polzu-otechestvennyh.html,"Mon, 06 Oct 2025 14:57:00 +0300"
Медицинские и технические вузы объединятся для создания инновационной медтехники,"В России может появиться первый распределенный инжиниринговый центр, который объединит ведущие медицинские и технические университеты страны для разработки прорывных медицинских изделий и технологий. С такой инициативой на международном форуме БИОПРОМ выступил ректор Сеченовского университета, академик РАН Петр Глыбочко.",https://rg.ru/2025/10/06/medicinskie-i-tehnicheskie-vuzy-obediniatsia-dlia-sozdaniia-innovacionnoj-medtehniki.html,"Mon, 06 Oct 2025 14:50:39 +0300"
"""Учитель года - 2022"" Лутовинов объяснил, грозят ли подарки педагогам штрафами","День учителя прошел, но эхом от него по Сети катятся новостные заголовки: ""Учителям грозят замечания и выговоры за подарки дороже 3 тысяч рублей"".",https://rg.ru/2025/10/06/uchitel-goda-2022-lutovinov-obiasnil-groziat-li-podarki-pedagogam-shtrafami.html,"Mon, 06 Oct 2025 14:48:26 +0300"
Вячеслав Гладков анонсировал курсы по медподготовке для школьников и студентов,"В Белгородской области 1584 школьника, студента колледжей и вузов пройдут дополнительную медицинскую подготовку 2025-2026 учебном году в Белгородской области, сообщил глава региона Вячеслав Гладков на еженедельном оперативном заседании правительства.",https://rg.ru/2025/10/06/reg-cfo/viacheslav-gladkov-anonsiroval-kursy-po-medpodgotovke-dlia-shkolnikov-i-studentov.html,"Mon, 06 Oct 2025 14:48:03 +0300"
Оргкомитет НРФ'9 поделился подробностями деловой программы предстоящего форума,"Современные стратегии и подходы при трансформации рекламного рынка, креативные практики и эффективное сотрудничество, особенности сферы диджитал в новой информационной реальности и многое другое обсудят в основные дни НРФ'9 с 12 по 14 ноября.",https://rg.ru/2025/10/06/orgkomitet-nrf9-podelilsia-podrobnostiami-delovoj-programmy-predstoiashchego-foruma.html,"Mon, 06 Oct 2025 14:46:08 +0300"
"Следователи из-за погоды две недели не могли вылететь в село, где погиб ребенок","Следователи из-за плохих метеоусловий более двух недель не могли вылететь в село Юкагир Усть-Янского района Якутии, где под колесами трактора погибла восьмилетняя девочка. Об этом сообщил <a href=""https://ria.ru"" rel=""noopener noreferrer"" target=""_blank"">РИА Новости</a> министр транспорта и дорожного хозяйства Якутии Владимир Сивцев.",https://rg.ru/2025/10/06/reg-dfo/sledovateli-iz-za-pogody-dve-nedeli-ne-mogli-vyletet-v-selo-gde-pogib-rebenok.html,"Mon, 06 Oct 2025 14:46:00 +0300"
"На ТВ-3 состоится премьера второго сезона телехита ""Ронин""","Сегодня в 18:00 на телеканале ТВ-3 состоится премьера <a href=""https://rg.ru/2025/04/15/startovali-semki-vtorogo-sezona-ronina-s-dmitriem-palamarchukom.html"" rel=""noopener noreferrer"" target=""_blank"">второго сезона хитового сериала ""Ронин""</a>.",https://rg.ru/2025/10/06/na-tv-3-sostoitsia-premera-vtorogo-sezona-telehita-ronin.html,"Mon, 06 Oct 2025 14:45:12 +0300"
Китайцы скопировали Zeekr 9X и продают очень дешево: авто сняли на фото,В Китае появился Zeekr 9X в формате Lao Tou Le (дословно - радость старика) - маленький и ультрадешевый электрокар с характерным дизайном какой-либо оригинальной модели. На этот раз был выбран едва успевший выйти на рынок Zeekr 9X.,https://rg.ru/2025/10/06/kitajcy-skopirovali-zeekr-9x-i-prodaiut-ochen-deshevo-avto-sniali-na-foto.html,"Mon, 06 Oct 2025 14:44:01 +0300"
"Польский суд продлил арест подозреваемого в подрыве ""Северных потоков""","Окружной суд Варшавы продлил временный арест подозреваемого в совершении теракта на газопроводах ""Северные потоки"" - украинца Владимира Журавлева. Об этом проинформировала пресс-секретарь суда Анна Пташик.",https://rg.ru/2025/10/06/polskij-sud-prodlil-arest-podozrevaemogo-v-podryve-severnyh-potokov.html,"Mon, 06 Oct 2025 14:44:00 +0300"
Ректор МГТУ им. Баумана извинился за оскорбления в адрес футбольного ЦСКА,Ректор Московского государственного технического университета (МГТУ) имени Н. Э. Баумана Михаил Гордин принес свои извинения за негативный комментарий в адрес футбольного клуба ЦСКА.,https://rg.ru/2025/10/06/rektor-mgtu-im-baumana-izvinilsia-za-oskorbleniia-v-adres-futbolnogo-cska.html,"Mon, 06 Oct 2025 14:41:08 +0300"
"Татарстанский бренд ""ТАТКРАН"" планирует расширить свое производство на Беларусь и новые регионы России","Практически все субъекты РФ и с десяток зарубежных стран, в числе которых Китай, Малайзия, Казахстан, Кыргызстан, Узбекистан, представили свои бизнес-компании на международной выставке ""ИННОПРОМ. Беларусь"", проходящей в эти дни в Минске.",https://rg.ru/2025/10/06/tatarstanskij-brend-tatkran-planiruet-rasshirit-svoe-proizvodstvo-na-belarus-i-novye-regiony-rossii.html,"Mon, 06 Oct 2025 14:40:47 +0300"
Белорусские гребцы добавили в копилку команды более десяти наград,"Очередная спортивная неделя для белорусских атлетов началась на III Играх стран СНГ в Азербайджане с завоевания в упорной борьбе более десятка наград по итогам финиша на гребном канале, информирует <a href=""https://belta.by"" rel=""noopener noreferrer"" target=""_blank"">БЕЛТА</a>. В понедельник, 6 октября, информирует БЕЛТА, в городе Мингячевире, расположенном на берегах Куры, были разыграны шесть комплектов наград. На дистанции тысяча метров в мужской байдарке-одиночке среди молодежи до 20 лет лучший результат показал Илья Филимонов, в этом же виде программы у юношей до 16 лет успех праздновал Артем Вайтешин. Комментаторы напоминают, что в первый день состязаний - 5 октября - оба белоруса победили на дистанциях вдвое короче.",https://rg.ru/2025/10/06/belorusskie-grebcy-dobavili-v-kopilku-komandy-bolee-desiati-nagrad.html,"Mon, 06 Oct 2025 14:40:11 +0300"
Во Франции сменилось пять премьер-министров за два года,"Во Франции сегодня подал в отставку очередной премьер-министр Себастьен Лекорню. В кресле главы правительства он провел всего 27 дней, что стало рекордом за всю историю.",https://rg.ru/2025/10/06/vo-francii-smenilos-piat-premer-ministrov-za-dva-goda.html,"Mon, 06 Oct 2025 14:37:05 +0300"
"5 октября состоялось торжественное открытие IV Международной Школы Интернет-БЕЗопасности молодежи ""Человек и технологии""","С 5 по 9 октября 2025 года на базе Мастерской управления ""Сенеж"" президентской платформы ""Россия - страна возможностей"" проходит IV Международная Школа Интернет-БЕЗопасности молодежи ""Человек и технологии"".",https://rg.ru/2025/10/06/5-oktiabria-sostoialos-torzhestvennoe-otkrytie-iv-mezhdunarodnoj-shkoly-internet-bezopasnosti-molodezhi-chelovek-i-tehnologii.html,"Mon, 06 Oct 2025 14:31:07 +0300"
На форуме БИОПРОМ обсудили применение прорывной технологии в лечении рака,"Одна из труднопреодолимых проблем в лечении онкозаболеваний заключается в том, что раковые клетки обладают свойством ""укрываться"" от иммунитета пациента. Ученые долгое время искали возможности, как обойти этот барьер.",https://rg.ru/2025/10/06/na-forume-bioprom-obsudili-primenenie-proryvnoj-tehnologii-v-lechenii-raka.html,"Mon, 06 Oct 2025 14:28:43 +0300"
"Никита Кологривый: Все звезды у нас с обложки, а я - с верхней полки плацкарта","Актер Никита Кологривый станет первым героем программы ""Эксклюзив"" в новом сезоне.",https://rg.ru/2025/10/06/nikita-kologrivyj-vse-zvezdy-u-nas-s-oblozhki-a-ia-s-verhnej-polki-plackarta.html,"Mon, 06 Oct 2025 14:27:07 +0300"
"""Калашников"" показал применение винтовки СВДС против тяжелых дронов ВСУ","Концерн ""Калашников"" опубликовал видео Минобороны РФ с учебного полигона группы войск ""Центр"". В ролике стрелков обучают работе из снайперской винтовки Драгунова со складным прицелом *(СВДС) по актуальным целям - например, тяжелым мультикоптерам ""Баба-яга"".",https://rg.ru/2025/10/06/kalashnikov-pokazal-primenenie-vintovki-svds-protiv-tiazhelyh-dronov-vsu.html,"Mon, 06 Oct 2025 14:26:05 +0300"
"Названы звездные участники нового аналога ""Форта Боярд""","Телеканал СТС объявляет звездный состав своего нового шоу <a href=""https://rg.ru/2025/06/20/sts-zapuskaet-prikliuchencheskoe-teleshou-fort-vozvrashchenie-legendy.html"" rel=""noopener noreferrer"" target=""_blank"">""Форт. Возвращение легенды""</a>, премьера которого состоится уже 26 октября в 21:00.",https://rg.ru/2025/10/06/nazvany-zvezdnye-uchastniki-novogo-analoga-forta-boiard.html,"Mon, 06 Oct 2025 14:26:03 +0300"
В Новосибирской области более 600 единиц техники вышло на трассы для уборки снега,"В Новосибирской области организована круглосуточная работа снегоуборочной техники, также ведется обработка трасс противогололедными средствами.",https://rg.ru/2025/10/06/reg-sibfo/v-novosibirskoj-oblasti-bolee-600-edinic-tehniki-vyshlo-na-trassy-dlia-uborki-snega.html,"Mon, 06 Oct 2025 14:25:09 +0300"
Автомобильный бум: россияне начали сметать машины в Беларуси,"В ожидании возможного увеличения ставок утильсбора россияне активно начали обращать свой взор на рынки и автосалоны соседнего государства. Основной целью поездок в Беларусь является покупка машин, официально ввезенных на территорию республики более года назад, что дает возможность по старым правилам оплатить налог по льготной ставке.",https://rg.ru/2025/10/06/avtomobilnyj-bum-rossiiane-nachali-smetat-mashiny-v-belarusi.html,"Mon, 06 Oct 2025 14:25:07 +0300"
В Челябинске подросток погиб от удара током во время разговора по телефону,"В Челябинске выясняют обстоятельства гибели подростка, разговаривавшего по телефону, поставленному на зарядку. Возбуждено уголовное дело о причинении смерти по неосторожности, сообщили в понедельник в следственном управлении СК региона.",https://rg.ru/2025/10/06/reg-urfo/v-cheliabinske-podrostok-pogib-ot-udara-tokom-vo-vremia-razgovora-po-telefonu.html,"Mon, 06 Oct 2025 14:23:15 +0300"
В Саратовской области эксперты оценили потенциал промышленного туризма,В Саратовской области прошел Региональный практикум по развитию промышленного туризма. Мероприятие было организовано областными министерством инвестиционной политики и Корпорацией развития.,https://rg.ru/2025/10/06/reg-pfo/v-saratovskoj-oblasti-eksperty-ocenili-potencial-promyshlennogo-turizma.html,"Mon, 06 Oct 2025 14:22:02 +0300"
"""Радиостанция Судного дня"" повторила в эфире слово, переданное в феврале 2022-го","УВБ-76, известная как ""Радиостанция Судного дня"" или просто ""жужжалка"", сегодня передала сообщение, слово в котором повторяет то же, что звучало в эфире 11 февраля 2022 года.",https://rg.ru/2025/10/06/radiostanciia-sudnogo-dnia-povtorila-v-efire-slovo-peredannoe-v-fevrale-2022-go.html,"Mon, 06 Oct 2025 14:20:05 +0300"
"На ""Ленфильме"" откроют выставку к 100-летию Иннокентия Смоктуновского","На киностудии ""Ленфильм"" с 9 октября начнет работу масштабная выставка ""Русский Гамлет"", приуроченная к 100-летию со дня рождения народного артиста СССР Иннокентия Смоктуновского. Торжественное открытие экспозиции состоится накануне, 8 октября, в 20:30. Церемонию проведет внучка актера - актриса театра и кино Анастасия Смоктуновская.",https://rg.ru/2025/10/06/reg-szfo/na-lenfilme-otkroiut-vystavku-k-100-letiiu-innokentiia-smoktunovskogo.html,"Mon, 06 Oct 2025 14:20:01 +0300"
"Патрушев сообщил, что в 2025 году ожидается урожай в 135 миллионов тонн зерна","Вице-премьер правительства Дмитрий Патрушев рассказал президенту РФ Владимиру Путину о ситуации в сельском хозяйстве и доложил о ходе уборочных работ. По его словам, в этом году урожайность зерновых выросла на 10% по сравнению с прошлым годом.",https://rg.ru/2025/10/06/patrushev-soobshchil-chto-v-2025-godu-ozhidaetsia-urozhaj-v-135-millionov-tonn-zerna.html,"Mon, 06 Oct 2025 14:19:00 +0300"
Путин принял в Кремле Дмитрия Патрушева,"Президент РФ Владимир Путин в понедельник, 6 октября, провел встречу с заместителем председателя правительства Дмитрием Патрушевым. Одной из первых тем для обсуждения стала экология.",https://rg.ru/2025/10/06/putin-prinial-v-kremle-dmitriia-patrusheva.html,"Mon, 06 Oct 2025 14:16:08 +0300"
Актер Манчан Маган умер вскоре после своего 55-летия от страшной болезни,"Ушел из жизни Манчан Маган, в конце августа ирландский артист отмечал свое 55-летие.",https://rg.ru/2025/10/06/akter-manchan-magan-umer-vskore-posle-svoego-55-letiia-ot-strashnoj-bolezni.html,"Mon, 06 Oct 2025 14:15:01 +0300"
"Эксперт Тузов объяснил, что грозит рынку после вступления в силу закона о такси","Независимый эксперт транспортной отрасли Алексей Тузов рассказал ""Российской газете"" о том, что произойдет с автомобильным рынком после вступления в силу нового закона о локализации в такси.",https://rg.ru/2025/10/06/ekspert-tuzov-obiasnil-chto-grozit-rynku-posle-vstupleniia-v-silu-zakona-o-taksi.html,"Mon, 06 Oct 2025 14:14:59 +0300"
Курский губернатор снова обратится в ФАС по поводу ситуации с бензином,"Губернатор Александр Хинштейн в понедельник <a href=""https://t.me/Hinshtein/15237"" rel=""noopener noreferrer"" target=""_blank"">заявил</a>, что сегодня еще раз свяжется с ФАС по поводу ситуации с топливом в Курской области.",https://rg.ru/2025/10/06/reg-cfo/kurskij-gubernator-snova-obratitsia-v-fas-po-povodu-situacii-s-benzinom.html,"Mon, 06 Oct 2025 14:14:02 +0300"
"Макрон после отставки правительства отправился на прогулку, его сняли на видео",Французского лидера Эмманюэля Макрона спустя несколько часов после объявления об отставке едва назначенного правительства заметили прогуливающимся в одиночестве по набережной в Париже. Соответствующие кадры показал телеканал BFMTV.,https://rg.ru/2025/10/06/makron-posle-otstavki-pravitelstva-otpravilsia-na-progulku-ego-sniali-na-video.html,"Mon, 06 Oct 2025 14:14:00 +0300"
