Title,Description,Link,Publication Date
"Трамп пообещал лидерам арабских стран, что Израиль не начнет новый конфликт","Президент США Дональд Трамп во время обсуждения в Белом доме плана по урегулированию ситуации в секторе Газа гарантировал лидерам арабских стран отказ Израиля от силовых акций в дальнейшем, сообщает в понедельник Financial Times (FT) со ссылкой на источники.""Трамп лично гарантировал главам арабских стран, что Израиль не начнет войну"", - сказал собеседник газеты.По словам источников, делегация во главе с израильским премьером Биньямином Нетаньяху пыталась добиться для себя возможности возобновления боевых действий, если ХАМАС нарушит условия соглашения, в частности отказ от любой формы управления этим движением Газой.Американская сторона, по данным FT, ""буквально велела израильским переговорщикам прекратить искать какие-либо лазейки"".29 сентября Трамп обнародовал свой план урегулирования в Газе.",https://www.interfax.ru/world/1051093,"Mon, 6 Oct 2025 15:04:00 +0300"
"Tata Capital планирует крупнейшее IPO года в Индии на $1,7 млрд",Индийская финансовая Tata Capital Ltd.,https://www.interfax.ru/world/1051094,"Mon, 6 Oct 2025 15:02:00 +0300"
BASF приблизилась к продаже Carlyle подразделения лакокрасочных материалов за 7 млрд евро,"Германская химкомпания BASF близка к продаже подразделения по выпуску лакокрасочных материалов американской Carlyle за 7 млрд евро, пишет газета Financial Times со ссылкой на источники.BASF провела аукцион, который привлек интерес нескольких инвесткомпаний, включая KPS Capital Partners.",https://www.interfax.ru/world/1051091,"Mon, 6 Oct 2025 14:57:00 +0300"
Комитет Думы поддержал продление моратория на одновременную уплату налогов при выплате зарплаты по ГОЗ,"Комитет Госдумы по бюджету рекомендовал принять в первом чтении законопроект о продлении до 31 декабря 2026 года для исполнителей гособоронзаказа возможности выплачивать зарплату с отдельного банковского счета без одновременного перечисления уплаты налогов и страховых взносов.Законопроект № 1019756-8 в сентябре внесло в парламент правительство.""Законопроект предлагает продлить до 31 декабря 2026 года мораторий на одновременную уплату налогов и страховых взносов при оплате труда работников с отдельных счетов предприятий - участников ГОЗ в связи с проводимой оптимизацией института единого налогового счета"", - сказал депутатам первый замминистра обороны Леонид Горнин.",https://www.interfax.ru/russia/1051088,"Mon, 6 Oct 2025 14:57:00 +0300"
Комитет Думы поддержал централизацию постановки на налоговый учет иностранных компаний через банки,"Комитет Госдумы по бюджету и налогам на заседании в понедельник поддержал к принятию в первом чтении законопроект, который оставляет для иностранных организаций только один способ постановки на налоговый учет при открытии счета - через банки.",https://www.interfax.ru/russia/1051089,"Mon, 6 Oct 2025 14:55:00 +0300"
Фабио Каннаваро возглавил сборную Узбекистана,"Чемпион мира по футболу Фабио Каннаваро стал главным тренером сборной Узбекистана, говорится в сообщении в телеграм-канале футбольной федерации страны.""Итальянский тренер подготовит нашу команду к чемпионату мира, который пройдет на полях США, Канады и Мексики"", - говорится в сообщении.Сроки контракта со специалистом не уточняются.Для Узбекистана ЧМ-2026 будет дебютным чемпионатом мира.Предыдущим местом работы 52-летнего Каннаваро было загребское ""Динамо"".Каннаваро – бывший защитник итальянских ""Наполи"", ""Пармы"", ""Интера"", ""Ювентуса"", испанского ""Реала"", а также команды ""Аль-Ахли"" из ОАЭ.",https://www.sport-interfax.ru/1051090,"Mon, 6 Oct 2025 14:51:00 +0300"
Фигурант дела о хищении 200 млн рублей Минобороны осужден условно в Петербурге,"Санкт-Петербургский городской суд огласил приговор о хищении денег, выделенных Минобороны РФ на научно-исследовательские работы, сообщает в понедельник объединенная пресс-служба судов северной столицы.Валерий Дрогалин, признанный виновным в особо крупном мошенничестве, получил наказание в виде четырех лет лишения свободы условно.",https://www.interfax.ru/russia/1051086,"Mon, 6 Oct 2025 14:46:00 +0300"
Asahi частично возобновила выпуск и поставки пива после кибератаки,"Японский производитель продуктов питания и напитков Asahi Group частично возобновил производство и поставки пива в Японии после произошедшей на прошлой неделе кибератаки, пишет The Wall Street Journal со ссылкой на представителя компании.Выпуск пива и других напитков возобновился 2 октября на шести японских заводах, после чего возобновились и поставки.Asahi неделей ранее приостановила поставки некоторых напитков после того, как кибератака нарушила работу ее системы приема и доставки заказов.",https://www.interfax.ru/business/1051087,"Mon, 6 Oct 2025 14:40:00 +0300"
Власти Кубани назвали временными ограничения на продажу топлива на ряде АЗС,"Возможные ограничения продажи топлива на отдельных АЗС Краснодарского края носят временный характер и связаны с логистикой, сообщила пресс-служба Министерства топливно-энергетического комплекса и ЖКХ региона.""Ситуация с поставками топлива в регионе находится на контроле.",https://www.interfax.ru/russia/1051085,"Mon, 6 Oct 2025 14:38:00 +0300"
OpenAI может получить 10% акций AMD в рамках сделки на десятки миллиардов долларов,"Американская ИИ-компания OpenAI может получить 10% акций чипмейкера Advanced Micro Devices (AMD).Компании заключили сделку, в рамках которой AMD выпустила в пользу OpenAI варрант на свои обыкновенные акции, говорится в их сообщении.",https://www.interfax.ru/business/1051084,"Mon, 6 Oct 2025 14:36:00 +0300"
"""Автотор"" в 2024 году собрал автомобилей в три раза меньше, чем планировал","Калининградский ""Автотор"" в 2024 году произвел 30,4 тыс.",https://www.interfax.ru/business/1051080,"Mon, 6 Oct 2025 14:34:00 +0300"
Грузоотправителей обяжут согласовывать заявки на перевозку грузов с ж/д операторами,Грузоотправителей могут обязать согласовывать заявки на перевозку грузов с железнодорожными операторами.,https://www.interfax.ru/russia/1051083,"Mon, 6 Oct 2025 14:30:00 +0300"
"Brent подорожала до $65,48 за баррель","Цены на нефть ускорили рост днем в понедельник, трейдеры оценивают баланс спроса и предложения на рынке после менее существенного, чем ожидалось, увеличения квот на добычу странами-участницами ОПЕК+.К 13:55 по Москве декабрьские фьючерсы на Brent дорожали на лондонской бирже ICE Futures на $0,95 (1,47%) до $65,48 за баррель.",https://www.interfax.ru/business/1051082,"Mon, 6 Oct 2025 14:25:00 +0300"
"В Курской области АЗС ""Роснефти"" сделали двухнедельный запас топлива",Все заправочные сети региона отмечают рост потребления на 50%,https://www.interfax.ru/russia/1051079,"Mon, 6 Oct 2025 14:22:00 +0300"
Дмитрий Патрушев заявил о сокращении экспорта зерна из РФ из-за низких цен,РФ в 2025/26 году снижает экспорт зерна из-за низких цен на мировом рынке.,https://www.interfax.ru/business/1051081,"Mon, 6 Oct 2025 14:21:00 +0300"
Рельсовый автобус совершил тестовую поездку по маршруту Смоленск - Витебск,Регулярные пассажирские перевозки начнутся в 2026 году,https://tass.ru/ekonomika/25263123,"Mon, 06 Oct 2025 16:02:44 +0300"
На юге Ирана нашли новые запасы газа объемом более 280 млрд кубометров,"Министр нефти республики Мохсен Пакнежад заявил, что это может сыграть важную роль в пресечении энергетического дисбаланса страны в ближайшие годы",https://tass.ru/ekonomika/25263505,"Mon, 06 Oct 2025 16:01:08 +0300"
"Минфин выплатил купон по евробондам на 6,9 млрд рублей",Срок погашения был установлен в 2042 году,https://tass.ru/ekonomika/25263547,"Mon, 06 Oct 2025 16:00:27 +0300"
Космонавт Матвеев: летчики из Индии прошли подготовку в РФ и готовы к полету,"Денис Матвеев отметил, что он не видит ""никаких препятствий для выполнения поставленной задачи в рамках национальной пилотируемой программы""",https://tass.ru/kosmos/25263513,"Mon, 06 Oct 2025 15:59:40 +0300"
В регионах ПФО ожидается теплая погода с небольшими дождями,В некоторых областях сохраняется высокая пожарная опасность,https://tass.ru/obschestvo/25263415,"Mon, 06 Oct 2025 15:58:01 +0300"
Марочко: после освобождения Отрадного ВС РФ начали активно продвигаться на юг,"Военный эксперт отметил, что российские войска продолжают формировать буферную зону на стыке с Белгородской областью",https://tass.ru/armiya-i-opk/25263491,"Mon, 06 Oct 2025 15:57:37 +0300"
В Таганроге в ДТП с маршруткой пострадали четыре человека,"Водитель легкового автомобиля выехал на полосу встречного движения, в результате чего машина столкнулась с маршрутным такси",https://tass.ru/proisshestviya/25263455,"Mon, 06 Oct 2025 15:57:24 +0300"
Чуда не произошло: почему рейтинги британского премьера все ниже и при чем здесь Россия,"Елена Харитонова — о том, почему в Великобритании сменяются премьер за премьером и ждать ли ухода Стармера",https://tass.ru/opinions/25261839,"Mon, 06 Oct 2025 15:55:00 +0300"
"Бывший нападающий клубов НХЛ Маккегг стал игроком ""Шанхай Дрэгонс""",Контракт с канадским хоккеистом заключен до конца сезона,https://tass.ru/sport/25263481,"Mon, 06 Oct 2025 15:54:46 +0300"
"В Якутии создадут круглогодичный центр ""Воин""",В центре будут заниматься военно-спортивной подготовкой и патриотическим воспитанием молодежи,https://tass.ru/obschestvo/25263331,"Mon, 06 Oct 2025 15:54:12 +0300"
"Израиль ликвидировал командира сил воздушной обороны ""Хезболлах"" в Ливане","Хасан Али Джамиль Атви ""поддерживал связь с Ираном"", где закупал оборудование",https://tass.ru/mezhdunarodnaya-panorama/25263437,"Mon, 06 Oct 2025 15:51:49 +0300"
Из разбившегося в Красноярском крае Ан-2 изъяли образцы топлива,Следователи завершили работу на месте происшествия,https://tass.ru/proisshestviya/25263379,"Mon, 06 Oct 2025 15:51:13 +0300"
"В ГИМ откроется выставка экспонатов из музея-заповедника ""Царское Село""",Экспозицию можно будет посетить с 19 октября по 13 апреля,https://tass.ru/kultura/25263445,"Mon, 06 Oct 2025 15:51:04 +0300"
Яровая призвала как можно скорее разработать профстандарт в сфере биоэкономики,"В ближайшее время биоэкономика станет ""самым важным направлением в экономике страны"", отметила вице-спикер Госдумы",https://tass.ru/ekonomika/25263419,"Mon, 06 Oct 2025 15:49:41 +0300"
"Зеленский утверждает, что США разрешили закупки Patriot","Остро стоит только вопрос финансирования, отметил Владимир Зеленский",https://tass.ru/mezhdunarodnaya-panorama/25263395,"Mon, 06 Oct 2025 15:49:41 +0300"
Путин поручил смягчить условия госэкспертизы для приоритетных проектов,Срок исполнения поручения установлен до 2 февраля 2026 года,https://tass.ru/politika/25263387,"Mon, 06 Oct 2025 15:48:34 +0300"
ЦБ: стоимость ОСАГО при отмене учета износа может вырасти на 40%,"За первое полугодие 2025 года число жалоб на ОСАГО упало с 15 тыс. до 6 тыс., отметил зампред Банка России Филипп Габуния",https://tass.ru/ekonomika/25263369,"Mon, 06 Oct 2025 15:48:33 +0300"
В Волгоградской области завели дело о мошенничестве на 52 млн рублей,Генерального директора строительной фирмы подозревают в присвоении денег при ремонте школы в Волжском,https://tass.ru/proisshestviya/25263359,"Mon, 06 Oct 2025 15:47:47 +0300"
В Карелии экс-глава района незаконно получил 1 млн рублей,Чиновник издавал распоряжения о выплате себе премий и надбавок,https://tass.ru/proisshestviya/25263171,"Mon, 06 Oct 2025 15:47:46 +0300"
"КДК рассмотрит зажжение файера фанатами ""Спартака"" на матче Кубка России","1 октября красно-белые в гостях обыграли ""Пари НН"" со счетом 2:1",https://tass.ru/sport/25263367,"Mon, 06 Oct 2025 15:46:03 +0300"
"ФГ БКС опровергла информацию о покупке банка ""Форштадт""",Об этом ТАСС сообщили в пресс-службе БКС,https://tass.ru/ekonomika/25263361,"Mon, 06 Oct 2025 15:46:00 +0300"
В Душанбе открылась выставка о вкладе культуры и науки РФ в мировую цивилизацию,"Руководитель представительства Россотрудничества Андрей Патрушев назвал эту выставку масштабным и уникальным мероприятием, отметив, что она впервые проходит в Таджикистане",https://tass.ru/obschestvo/25263107,"Mon, 06 Oct 2025 15:45:48 +0300"
Министр экономики Германии призвала к наращиванию производства БПЛА в стране,"По словам Катерины Райхе, необходимо быстрыми темпами наращивать производства беспилотников и постоянно разрабатывать новые технологии в этой сфере, в том числе с использованием искусственного интеллекта",https://tass.ru/ekonomika/25263337,"Mon, 06 Oct 2025 15:45:35 +0300"
Мурманская область ежегодно нуждается в 11-20 млрд рублей для закупки мазута,"Глава региона Андрей Чибис сообщил, что договорился с министром финансов РФ Антоном Силуановым об опережающем финансировании закупок мазута по прогнозной цене",https://tass.ru/ekonomika/25263313,"Mon, 06 Oct 2025 15:44:06 +0300"
Замминистра Шойтов: спрос на кадры в области IТ-безопасности возрастет,"Заместитель министра цифрового развития, связи и коммуникаций также заявил, что ИИ доверят решать достаточно простые традиционные задачи в области ИБ",https://tass.ru/ekonomika/25263319,"Mon, 06 Oct 2025 15:44:03 +0300"
На Кубани назвали временными ограничения на отдельных заправках,"Ситуация с поставками топлива в регионе находится на контроле, отметили в оперштабе",https://tass.ru/ekonomika/25263247,"Mon, 06 Oct 2025 15:43:24 +0300"
В Казахстане снимут новый фильм с Джеки Чаном,"Речь идет о работе над новой частью франшизы ""Доспехи Бога""",https://tass.ru/kultura/25262135,"Mon, 06 Oct 2025 15:42:01 +0300"
"Ридли Скотт считает, что современная киноиндустрия ""тонет в посредственности""",Режиссер раскритиковал чрезмерное использование цифровых эффектов в картинах,https://tass.ru/kultura/25263253,"Mon, 06 Oct 2025 15:41:58 +0300"
ЗАЭС продолжает работу от генераторов,"Радиационная обстановка на промплощадке атомной станции остается в норме, сообщили в Ростехнадзоре",https://tass.ru/mezhdunarodnaya-panorama/25263183,"Mon, 06 Oct 2025 15:41:19 +0300"
Землю Ходорковского и Лебедева по иску ФССП обратили в доход государства,"Речь идет о земельном участке бывшего совладельца ЮКОСа Владимира Дубова, который фактически принадлежит экс-главе компании",https://tass.ru/ekonomika/25263305,"Mon, 06 Oct 2025 15:39:12 +0300"
Регионы ДФО восстановили в ДНР более 1 тыс. соцобъектов с 2022 года,"В 2025 году на подшефных территориях работы велись на 178 объектах, из которых 159 уже завершены",https://tass.ru/obschestvo/25263219,"Mon, 06 Oct 2025 15:37:25 +0300"
В Орловской области опровергли данные об ограничении въезда жителей ДНР в регион,В социальных сетях распространилось фейковое постановление о временном ограничении въезда якобы из-за угрозы распространения холеры,https://tass.ru/obschestvo/25263277,"Mon, 06 Oct 2025 15:37:00 +0300"
Эксперт Масликов: средняя стоимость унции золота в 2025 году составит $3 250,"Рост цен на золото, в частности, стимулируется спросом со стороны центральных банков, стремящихся к диверсификации своих резервов, отметил аналитик ""БКС мир инвестиций""",https://tass.ru/ekonomika/25263269,"Mon, 06 Oct 2025 15:36:14 +0300"
Цыденов предложил передать регионам программы по льготному обеспечению лекарствами,"Глава Бурятии отметил, что это позволит избежать дублирования помощи и предоставить получателям выбор между получением лекарств или денежной компенсацией",https://tass.ru/obschestvo/25263093,"Mon, 06 Oct 2025 15:33:27 +0300"
"""Салават Юлаев"" подписал полноценный контракт с хоккеистом Хохлачевым",Соглашение рассчитано до конца сезона,https://tass.ru/sport/25263261,"Mon, 06 Oct 2025 15:33:24 +0300"
Крымчанину дали год колонии-поселения за призывы к экстремизму,Мужчина в соцсетях призывал к насильственным действиям против группы лиц по признаку национальности,https://tass.ru/proisshestviya/25263195,"Mon, 06 Oct 2025 15:33:05 +0300"
Суд арестовал имущество бывшего первого замглавы Росгвардии на 25 млн рублей,Виктора Стригунова обвиняют во взяточничестве,https://tass.ru/proisshestviya/25263241,"Mon, 06 Oct 2025 15:32:11 +0300"
FAZ: Daimler Truck поставит Киеву около тысячи военных грузовиков Zetros,"Грузовые машины такого типа используются для снабжения боевых частей, перевозки личного состава и эвакуации раненых",https://tass.ru/mezhdunarodnaya-panorama/25263209,"Mon, 06 Oct 2025 15:31:50 +0300"
